{
  "metric_snapshot_id": "metrics.seed.Generative_AI.v0.1",
  "policy_graph_version": "Generative_AI.v0.1",
  "label_version": "manual_seed_2026_05_09",
  "truth_label_tiers": [
    "gold",
    "platinum"
  ],
  "split": "development",
  "status": "not_enough_data",
  "mock_only": true,
  "denominators": {
    "n_total": 2,
    "n_positive": 1,
    "n_negative": 1,
    "n_abstain": 1
  },
  "confusion_matrix": {
    "tp": null,
    "fp": null,
    "tn": null,
    "fn": null
  },
  "metrics": {
    "accuracy": null,
    "precision": null,
    "recall": null,
    "fpr": null,
    "positive_proportion": null,
    "informedness": null,
    "macro_f1": null,
    "calibration_ece": null,
    "graph_location_accuracy": null
  },
  "confidence_intervals": {
    "method": "none",
    "alpha": 0.05,
    "intervals": {}
  },
  "graph_health": {
    "node_count": 13,
    "edge_count": 20,
    "coverage": 0.08,
    "gray_zone_mass": null,
    "orphan_nodes": 0,
    "consensus_audit_error_rate": null,
    "sme_override_rate": null,
    "per_node_difficulty": {},
    "per_node_coverage": {}
  },
  "warning": "Placeholder \u2014 all decision-quality metrics are null until golden-set images are labeled and SME-reviewed. Graph-health values reflect v0.1 scaffold structure only."
}
